{
  "$schema": "http://json-schema.org/draft-07/schema#",
  "$id": "urn:pulse:schema:pulse.demopack.v1",
  "title": "Pulse demo content pack (pulse.demopack.v1)",
  "description": "The seed pack scripts/uat/Seed-DemoContent.ps1 loads into an exercise (demo-polish implementation.md section 1.10). File paths are relative to the folder that holds pack.json. This schema covers the SHAPE. The seeder also enforces the rules a JSON Schema cannot express, before it sends anything: keys are unique, every ref resolves, a reply comes after its parent in the array and not earlier in scenario time, text is at most 280 code points (an emoji counts once), each file exists inside the pack folder, its first bytes are JPEG/PNG/GIF/WebP (images) or MP4/WebM (videos) and match its kind, images are at most 5 MiB and videos at most 100 MiB, a post carries up to 4 images or exactly 1 video (never both), a burst's window holds 3 s between posts (at least 3 x (posts - 1) seconds), a run-sheet reply names an earlier post of its own item or a post of an EARLIER item (no loops), and every handle and run-sheet assignee exists in the exercise (checked after sign-in). Keys must also be unique ignoring case.",
  "type": "object",
  "additionalProperties": false,
  "required": ["schema", "personas", "media", "posts"],
  "properties": {
    "$schema": { "type": "string", "description": "Optional editor hint pointing at this file." },
    "schema": { "const": "pulse.demopack.v1" },
    "county": { "type": "string", "description": "Informational: the fictional county the pack depicts." },
    "personas": {
      "type": "array",
      "description": "Profile edits for personas that ALREADY exist in the exercise (the seeder never creates personas). Absent field = unchanged; null clears bio, location, avatar or banner.",
      "items": { "$ref": "#/definitions/persona" }
    },
    "media": {
      "type": "array",
      "description": "Every uploadable post attachment, by pack-local key.",
      "items": { "$ref": "#/definitions/media" }
    },
    "posts": {
      "type": "array",
      "description": "The opening feed. Posted as controller-as-persona in scenario-time order (scenarioTime = anchor - minutesBeforeAnchor); ties keep array order.",
      "items": { "$ref": "#/definitions/post" }
    },
    "runSheet": { "$ref": "#/definitions/runSheet" }
  },
  "definitions": {
    "key": {
      "type": "string",
      "pattern": "^[A-Za-z0-9_-]{1,64}$",
      "description": "A pack-local key: letters, digits, '_' and '-', 1 to 64 characters."
    },
    "handle": {
      "type": "string",
      "minLength": 1,
      "maxLength": 50,
      "pattern": "^[^@\\s]+$",
      "description": "A persona handle without '@' (e.g. FulcoEM). Matched case-insensitively against the exercise's personas."
    },
    "file": {
      "type": "string",
      "minLength": 1,
      "pattern": "^(?![/\\\\])(?![A-Za-z]:)",
      "description": "A path relative to the pack folder (e.g. media/water.jpg). It must stay inside the pack folder."
    },
    "alt": {
      "type": "string",
      "minLength": 1,
      "maxLength": 1000,
      "pattern": "\\S",
      "not": { "$ref": "#/definitions/markup" },
      "description": "Alt text (NFR-001). Required, not blank, at most 1000 characters, no markup."
    },
    "markup": {
      "type": "string",
      "pattern": "<[A-Za-z/!?]",
      "description": "Markup-like text ('<' then a letter, '/', '!' or '?'). The server strips tags, so such text would not read as written; every free-text field refuses it. '<' before a space or a digit is fine."
    },
    "postText": {
      "type": "string",
      "maxLength": 280,
      "not": { "$ref": "#/definitions/markup" },
      "description": "At most 280 code points, no markup. The seeder counts code points; a schema validator may count differently for emoji."
    },
    "baseline": {
      "type": "object",
      "additionalProperties": false,
      "description": "The staff-only seeded engagement (the fictional crowd). Integers 0 to 1,000,000.",
      "properties": {
        "like": { "type": "integer", "minimum": 0, "maximum": 1000000 },
        "repost": { "type": "integer", "minimum": 0, "maximum": 1000000 },
        "reply": { "type": "integer", "minimum": 0, "maximum": 1000000 }
      }
    },
    "persona": {
      "type": "object",
      "additionalProperties": false,
      "required": ["handle"],
      "properties": {
        "handle": { "$ref": "#/definitions/handle" },
        "displayName": {
          "type": "string",
          "minLength": 1,
          "maxLength": 100,
          "pattern": "\\S",
          "not": { "$ref": "#/definitions/markup" },
          "description": "1 to 100 characters, at least one visible; no control or bidirectional-override characters; no markup."
        },
        "bio": {
          "type": ["string", "null"],
          "maxLength": 512,
          "not": { "$ref": "#/definitions/markup" },
          "description": "At most 512 characters; line breaks and tabs allowed; no markup; null clears it."
        },
        "location": {
          "type": ["string", "null"],
          "maxLength": 100,
          "not": { "$ref": "#/definitions/markup" },
          "description": "At most 100 characters; no markup; null clears it."
        },
        "verified": { "type": "boolean" },
        "avatar": {
          "oneOf": [{ "$ref": "#/definitions/file" }, { "type": "null" }],
          "description": "An image file (uploaded, then set as avatarMediaId); null clears the avatar."
        },
        "banner": {
          "oneOf": [{ "$ref": "#/definitions/file" }, { "type": "null" }],
          "description": "An image file (uploaded, then set as bannerMediaId); null clears the banner."
        }
      }
    },
    "media": {
      "type": "object",
      "additionalProperties": false,
      "required": ["key", "file", "kind", "alt"],
      "properties": {
        "key": { "$ref": "#/definitions/key" },
        "file": { "$ref": "#/definitions/file" },
        "kind": { "enum": ["image", "video"] },
        "poster": {
          "$ref": "#/definitions/file",
          "description": "Videos only: an image uploaded first and passed as the video's posterMediaId."
        },
        "width": { "type": "integer", "minimum": 1, "maximum": 16384 },
        "height": { "type": "integer", "minimum": 1, "maximum": 16384 },
        "durationSec": {
          "type": "number",
          "exclusiveMinimum": 0,
          "maximum": 3600,
          "description": "Videos only."
        },
        "alt": { "$ref": "#/definitions/alt" }
      },
      "allOf": [
        {
          "if": { "properties": { "kind": { "const": "image" } } },
          "then": { "not": { "anyOf": [{ "required": ["poster"] }, { "required": ["durationSec"] }] } }
        }
      ]
    },
    "postMedia": {
      "type": "object",
      "additionalProperties": false,
      "required": ["ref"],
      "properties": {
        "ref": { "$ref": "#/definitions/key" },
        "alt": { "$ref": "#/definitions/alt", "description": "Overrides the media item's alt for this post." }
      }
    },
    "post": {
      "type": "object",
      "additionalProperties": false,
      "required": ["key", "persona", "text", "minutesBeforeAnchor"],
      "properties": {
        "key": { "$ref": "#/definitions/key" },
        "persona": { "$ref": "#/definitions/handle" },
        "text": { "$ref": "#/definitions/postText" },
        "minutesBeforeAnchor": {
          "type": "integer",
          "minimum": 0,
          "description": "scenarioTime = anchor - this many minutes. The anchor defaults to the time of the run (-ScenarioAnchor overrides it)."
        },
        "media": {
          "type": "array",
          "maxItems": 4,
          "items": { "$ref": "#/definitions/postMedia" },
          "description": "Up to 4 images or exactly 1 video, never both."
        },
        "replyTo": {
          "$ref": "#/definitions/key",
          "description": "The key of the parent post, which must appear EARLIER in this array."
        },
        "baseline": { "$ref": "#/definitions/baseline" }
      }
    },
    "injectItem": {
      "type": "object",
      "additionalProperties": false,
      "required": ["key", "kind", "title", "posts"],
      "description": "One run-sheet item: inject-queue 06's InjectItemWrite (POST /api/injects), with pack references where the wire has ids (persona for personaId, assignee for assigneeId, media[].ref for mediaId, replyTo naming a pack post or a run-sheet post). It lands pending at the end of the console's queue; nothing fires on its own.",
      "properties": {
        "key": { "$ref": "#/definitions/key", "description": "Stable pack key: the seed manifest maps it to the created item id, so a re-run never duplicates." },
        "kind": { "enum": ["post", "burst"], "description": "post: exactly 1 post. burst: 2 to 20 posts the server releases across burstWindowSeconds." },
        "title": {
          "type": "string",
          "minLength": 1,
          "maxLength": 120,
          "pattern": "\\S",
          "not": { "$ref": "#/definitions/markup" },
          "description": "Controller-facing, 1 to 120 code points after trimming; no markup."
        },
        "notes": {
          "type": "string",
          "maxLength": 500,
          "not": { "$ref": "#/definitions/markup" },
          "description": "Controller-facing, at most 500 code points; no markup."
        },
        "plannedMinute": {
          "type": "integer",
          "minimum": 0,
          "maximum": 2147483647,
          "description": "T+N shown in the console: a display and sort hint only (no scheduler)."
        },
        "assignee": {
          "type": ["string", "null"],
          "minLength": 1,
          "pattern": "\\S",
          "description": "\"me\" (the staff user who runs the seed), or the display name of a staff member assigned to the exercise, ignoring case (GET /api/injects/assignees). Absent or null: unassigned. Assignment is a filter, not a lock."
        },
        "burstWindowSeconds": {
          "type": "integer",
          "minimum": 30,
          "maximum": 600,
          "description": "Bursts only. Default 90. Must also be at least 3 x (posts - 1) (3 s between posts)."
        },
        "posts": {
          "type": "array",
          "minItems": 1,
          "maxItems": 20,
          "items": { "$ref": "#/definitions/injectPost" }
        }
      },
      "allOf": [
        {
          "if": { "properties": { "kind": { "const": "post" } } },
          "then": { "properties": { "posts": { "maxItems": 1 } }, "not": { "required": ["burstWindowSeconds"] } }
        },
        {
          "if": { "properties": { "kind": { "const": "burst" } } },
          "then": { "properties": { "posts": { "minItems": 2 } } }
        }
      ]
    },
    "injectPost": {
      "type": "object",
      "additionalProperties": false,
      "required": ["persona", "text"],
      "description": "One scripted post (InjectPostWrite).",
      "properties": {
        "persona": { "$ref": "#/definitions/handle", "description": "The authoring persona's handle; the seeder sends its id." },
        "text": {
          "allOf": [{ "$ref": "#/definitions/postText" }],
          "minLength": 1,
          "pattern": "\\S",
          "description": "1 to 280 code points after trimming; no markup."
        },
        "media": {
          "type": "array",
          "maxItems": 4,
          "items": { "$ref": "#/definitions/postMedia" },
          "description": "Pack media keys; up to 4 images or exactly 1 video, never both. Sent as { mediaId, alt }."
        },
        "replyTo": { "$ref": "#/definitions/injectReplyTo" },
        "engagementBaseline": { "$ref": "#/definitions/baseline" }
      }
    },
    "injectReplyTo": {
      "description": "Exactly one form. { postKey }: a post of this pack's opening feed (sent as { postId }). { sequence }: an EARLIER post of this item, 1-based (sent as { sequence }). { item, sequence }: a post of an EARLIER run-sheet item (sent as { injectPostId }); naming this item's own key is the same as { sequence }.",
      "oneOf": [
        {
          "type": "object",
          "additionalProperties": false,
          "required": ["postKey"],
          "properties": { "postKey": { "$ref": "#/definitions/key" } }
        },
        {
          "type": "object",
          "additionalProperties": false,
          "required": ["sequence"],
          "properties": { "sequence": { "type": "integer", "minimum": 1 } }
        },
        {
          "type": "object",
          "additionalProperties": false,
          "required": ["item", "sequence"],
          "properties": {
            "item": { "$ref": "#/definitions/key" },
            "sequence": { "type": "integer", "minimum": 1 }
          }
        }
      ]
    },
    "runSheet": {
      "type": "object",
      "additionalProperties": false,
      "required": ["items"],
      "description": "The scripted posts for the console's run sheet (inject-queue 06 + 07). After the opening feed is posted, the seeder creates each item with POST /api/injects, in this order.",
      "properties": {
        "items": { "type": "array", "items": { "$ref": "#/definitions/injectItem" } }
      }
    }
  }
}
